name,id,wikipedia_link,gender,scale,length
Carrer de l'Arc de Sant Pau,"18617908",,Male,,17.9382986827719
Carrer de Ferran Junoy,"159141212",,Male,,145.674341145737
Carrer de la Reina Amàlia,"4745025",https://es.wikipedia.org/wiki/Mar%C3%ADa_Amalia_de_Sajonia,Female,,229.567882852398
Carrer del Marquès de Campo Sagrado,"4745952",,Male,,16.9447967198237
Carrer del Tenor Masini,"4750183",,Male,,391.995355661962
Passatge del Regent Mendieta,"4750207",,Male,,85.7907499152492
Carrer de Sant Miquel,"4755002",,Male,,537.183744982456
Carrer de Sant Elm,"4755027",,Male,,307.781648141361
Carrer del Comte de Santa Clara,"4809727",https://es.wikipedia.org/wiki/Clara_de_As%C3%ADs,Female,,321.062888616018
Carrer del Rector Triadó,"4813522",,Male,,264.184320961821
Carrer de l'Hort de Sant Pau,"18502193",,Male,,42.455837699682
Carrer del Portal de Santa Madrona,"18596059",https://es.wikipedia.org/wiki/Madrona,Female,,47.9372639559018
Carrer de l'Arc de Sant Pau,"18617908",,Male,,47.1522903772752
Carrer de Josep Anselm Clavé,"18833123",,Male,,85.4325579979915
Avinguda de Mistral,"23348827",,Male,,280.479167994679
Avinguda de Mistral,"23348856",,Male,,97.9222794890217
Via Júlia,"26468379",,Female,,50.1514300326143
Carrer de Salvador Espriu,"31242172",,Male,,144.449728587903
Carrer Gran de Sant Andreu,"32321247",,Male,,82.3773060663276
Carrer de Rosa Sensat,"33502992",https://es.wikipedia.org/wiki/Rosa_Sensat_i_Vila,Female,,40.37798028441
Carrer de Joan Güell,"34054325",,Male,,860.288995943028
Avinguda de Sant Ramon Nonat,"34607742",,Male,,137.780625881293
Avinguda de Pearson,"35981177",,Male,,19.398008602186
Avinguda d'Albert Bastardas,"36542981",,Male,,54.7671570692104
Carrer del General Batet,"36542983",,Male,,53.4507351666534
Carrer de Jaume Martí,"36549179",,Male,,109.574376608966
Carrer de Pablo Iglesias,"38928852",,Male,,64.6704543592218
Passeig de Sant Antoni,"42520941",,Male,,143.809748916315
Carrer de Miquel Àngel,"42698365",,Male,,75.8826369260477
Carrer del Doctor Trueta,"42858991",,Male,,130.957599548514
Carrer de la Torre d'en Damians,"42884392",,Male,,23.3133993979111
Carrer d'Antonio Machado,"45113735",,Male,,144.77837487241
Carrer de Federico García Lorca,"45116367",,Male,,169.767565982104
Carrer Miguel Hernández,"45117270",,Male,,140.502859824118
Carrer de Roger,"45185740",,Male,,247.248760364435
Carrer de Rodríguez,"45185747",,Male,,5.24053965390434
Carrer de Julian Besteiro,"46800631",,Male,,23.8533172099287
Carrer de Sant Adrià,"46837704",,Male,,77.4055120958496
Camí de Cal Notari,"50147869",,Male,,298.814133898835
Carrer de Miret i Sans,"54856673",,Male,,14.8773837812188
Carrer de Sant Pau,"62213293",,Male,,115.034906348883
Passatge Jordi Ferran,"82650821",,Male,,0.476647580854235
Passatge Pere Rodríguez,"82650823",,Male,,105.426882545975
Avinguda Manuel Azaña,"96736895",,Male,,24.2573858912611
Avinguda Manuel Azaña,"96736958",,Male,,13.5041232330427
Carrer del Concili de Trento,"115799305",,Male,,197.756924396835
Carrer de Gabriel Ferrater,"120443035",,Male,,9.91119757121728
Carrer de Can Basseda,"120443056",,Male,,138.084980051872
Carrer de Teresa de Cofrents,"130581854",https://ca.wikipedia.org/wiki/Teresa_de_Cofrents,Female,,68.4865004061434
Carrer de Maria Reina,"135183778",,Female,,14.3102162374477
Carrer de Ramon Turró,"149178302",,Male,,676.262129143224
Carrer de Joaquim Valls,"154761062",,Male,,210.630569870259
Carrer de Josep Sunyol i Garriga,"159076647",,Male,,57.9962152830366
Carrer de Ferran Junoy,"159141212",,Male,,459.397783668291
Carrer d'Andrade,"165294205",,Male,,168.971746671754
Carrer de Watt,"178022693",,Male,,90.4763010783435
Carrer de González Tablas,"184444814",,Male,,111.688459373483
Carrer de Bonaventura Gispert,"191144253",,Male,,91.0770593927188
Carrer de Juan de Sada,"220275376",,Male,,3.58452588217668
Carrer de Santa Caterina de Siena,"230462409",https://es.wikipedia.org/wiki/Catalina_de_Siena,Female,,74.0141323322844
Carrer de la Capella de Can Caralleu,"237106601",,Male,,11.1890529767665
Carrer de Llull,"237657751",,Male,,9.16921104095169
Carrer de Jaume Roig,"239195663",,Male,,52.4629891964314
Carrer d'Eusebi Planas,"240144545",,Male,,2.97603745830625
Camí de Cal Notari,"243090157",,Male,,241.825157436357
Carrer de Galileu,"243598396",,Male,,850.276763386395
Via Júlia,"244451255",,Female,,110.727542585972
Carrer Cardenal Reig,"249808252",,Male,,233.247844787864
Carrer de Roc Boronat,"253456736",,Male,,9.13011776336495
Carrer de Sant Adrià,"256021236",,Male,,114.496607551011
Carrer de Sao Paulo,"263324421",,Male,,44.6626120827788
Carrer de Pere IV,"273302702",,Male,,127.045075605857
Carrer d'en Tissó,"290137831",,Male,,59.7473834206849
Passeig de Joan de Borbó,"291731095",,Male,,139.298069429682
Passeig de Sant Antoni,"294021550",,Male,,4.55978217918732
Passeig de Santa Coloma,"295009014",https://es.wikipedia.org/wiki/Columba_de_Sens,Female,,6.52113145507149
Carrer del Gran Capità,"314417325",,Male,,20.6420251279053
Passeig de Joan de Borbó,"359739476",,Male,,142.266273035861
Carrer del Regent Mendieta,"403019704",,Male,,58.2099861012129
Carrer de Comte Guell,"403019705",,Male,,58.2868255342596
Carrer de Montserrat,"423945726",,Female,,112.834925096271
Carrer del Rector de Vallfogona,"429288671",,Male,,60.686744776248
Carrer de Sant Joan de Malta,"440183357",,Male,,57.0690606846926
Carrer de Sancho d'Avila,"440773131",,Male,,13.2322797437548
Carrer Major de Can Caralleu,"461457684",,Male,,89.5537063018571
Carrer de Fernando Pessoa,"469102798",,Male,,41.7901182901489
Passeig de Sant Antoni,"497952259",,Male,,51.9381502473232
Carrer Cardenal Reig,"520581668",,Male,,218.660431319578
Carrer del Comte Borrell,"548391756",,Male,,19.0500449260792
Carrer de Joan d'Alòs,"552634567",,Male,,31.4398511150464
Carrer de Sor Eulàlia d'Anzizu,"571426636",,Female,,25.3502057280291
Ronda de Sant Pau,"601740758",,Male,,17.1724362062275
Carrer de Riego,"667405512",,Male,,52.2493770945131
Carrer de Can Basseda,"671640995",,Male,,247.126037122515
Passeig de Joan de Borbó,"4079500",,Male,,33.0652998061503
Carrer de Santa Margarida,"4743365",https://es.wikipedia.org/wiki/Margarita_de_Antioqu%C3%ADa,Female,,59.045716666475
Carrer de Sant Gil,"4743386",,Male,,158.431343291034
Carrer de Sant Vicenç,"4743390",,Male,,246.099238350001
Carrer de Sant Erasme,"4743393",,Male,,87.2973921868461
Carrer del Doctor Dou,"4743446",,Male,,177.363730892807
Carrer de Sant Antoni Abat,"4743454",,Male,,204.351568550396
Carrer de Ferran,"4743458",,Male,,321.193792798388
Carrer de Jaume I,"4743459",,Male,,168.296021617172
Carrer de Murillo,"4744779",,Male,,96.8081684570437
Carrer de Joan Gamper,"4744929",,Male,,70.3177602493443
Carrer d'en Santcliment,"4745023",,Male,,100.679583067092
Carrer de la Reina Amàlia,"4745025",https://es.wikipedia.org/wiki/Mar%C3%ADa_Amalia_de_Sajonia,Female,,141.587301845443
Carrer d'Ausiàs Marc,"4745453",,Male,,144.69691507539
Carrer de Roger de Flor,"4745495",,Male,,125.202141596822
Carrer de Sant Pere Més Baix,"4745603",,Male,,183.266912983162
Carrer del Marquès de Campo Sagrado,"4745952",,Male,,116.371087764682
Carrer del Comte Borrell,"4745960",,Male,,86.1749320906144
Carrer del Comte Borrell,"4745963",,Male,,399.637837999912
Carrer d'en Mònec,"4746876",,Male,,125.370712819314
Carrer del Bou de Sant Pere,"4746879",,Male,,89.445650281012
Carrer de la Mare de Déu del Pilar,"4746882",https://es.wikipedia.org/wiki/Virgen_del_Pilar,Female,,133.955045697619
Carrer de Buenaventura Muñoz,"4746907",,Male,,400.389920137876
Carrer de Xifré,"4746925",,Male,,545.038610773571
Carrer del Coronel Sanfeliu,"4746939",,Male,,127.509591417363
Carrer de Los Castillejos,"4746950",,Male,,234.915056586302
Carrer de Pau Claris,"4747009",,Male,,63.2699919881159
Carrer de Joan Massana,"4747012",,Male,,45.1502076985488
Carrer d'en Rull,"4747016",,Male,,98.4693315122877
Carrer d'en Roca,"4747019",,Male,,181.830879576432
Carrer del Duc,"4747020",,Male,,135.174287384081
Carrer de Domènech,"4747043",,Male,,52.0667311336319
Carrer de Sant Dalmir,"4747101",,Male,,120.068350762912
Carrer de Sant Tomas,"4747107",,Male,,276.564487909984
Carrer de Feliu i Codina,"4747111",,Male,,239.13127391748
Carrer de Martí i Alsina,"4747114",,Male,,173.466847127858
Carrer de Jaume Huguet,"4747131",,Male,,258.802848702844
Carrer del Rabí Rubén,"4747848",,Male,,165.871687665368
Carrer de Rossend Arús,"4747873",,Male,,203.608566808577
Carrer de Puig i Valls,"4747959",,Male,,200.796052609224
Carrer de Melcior de Palau,"4750165",,Male,,145.794522129898
Carrer d'Eusebi Planas,"4750167",,Male,,30.5398095596343
Carrer de Riego,"4750168",,Male,,61.0266159250668
Carrer de Watt,"4750169",,Male,,125.829330626112
Carrer del Tenor Masini,"4750183",,Male,,160.53629629847
carrer de sant Jordi,"4750184",,Male,,38.3494866998608
Carrer de Feliu Casanova,"4750186",,Male,,138.45437861107
Carrer de l'Escultor Canet,"4750187",,Male,,311.026935707348
Carrer del Regent Mendieta,"4750206",,Male,,128.19249353415
Passatge del Regent Mendieta,"4750207",,Male,,25.3352768536016
Carrer del Clos de Sant Francesc,"4750228",,Male,,260.021420871624
Carrer de Sant Liguori,"4750247",,Male,,49.8704422680655
Carrer de Bertran,"4750261",,Male,,549.549147778659
Carrer de Gomis,"4750277",,Male,,481.369177603927
Carrer del Mas Casanovas,"4750304",,Male,,133.603337073765
Carrer de Lluís Sagnier,"4750323",,Male,,13.3562525669776
Carrer de Francesc Tàrrega,"4750327",,Male,,354.641571145756
Carrer de Jordi de Sant Jordi,"4750334",,Male,,90.5285884715369
Carrer de la Comtessa de Pardo Bazán,"4750335",,Male,,166.285672066734
Carrer de Sant Narcís,"4750343",,Male,,195.226353595223
Carrer de Sant Hipòlit,"4750378",,Male,,264.430398067715
Carrer de Mir,"4750394",,Male,,168.932880987012
Carrer d'Agustí i Milà,"4750398",,Male,,311.763419629929
Carrer de Joaquim Valls,"4750425",,Male,,253.347456637432
Carrer de la Mare de Déu de Montserrat,"4750520",https://es.wikipedia.org/wiki/Virgen_de_Montserrat,Female,,129.461817648411
Carrer del Concili de Trento,"4750540",,Male,,379.248724545479
Carrer de Pere IV,"4750542",,Male,,143.316161807516
Carrer de Ramon Turró,"4750543",,Male,,667.606964862368
Carrer Antic de Sant Joan,"4750562",,Male,,187.286824658332
Carrer del Príncep de Viana,"4750627",,Male,,161.96393590447
Carrer de Mossèn Amadeu Oller,"4751582",,Male,,274.139333916466
Carrer d'Antoni de Capmany,"4751584",,Male,,71.5958674002964
Carrer de Bonaventura Pollés,"4751588",,Male,,191.48276587315
Carrer del Doctor Trueta,"4751884",,Male,,125.615674300861
Carrer de Marià Cubí,"4752018",,Male,,905.791063315415
Carrer de Bretón de los Herreros,"4752026",,Male,,164.085404475716
Carrer de Cornet i Mas,"4752046",,Male,,150.799066987335
Carrer del Pedró de la Creu,"4752053",,Male,,99.410007763897
Carrer de Sabino Arana,"4752116",,Male,,238.178510686466
Carrer de Comte Guell,"4752121",,Male,,142.898880728511
Carrer de Josep Estivill,"4753769",,Male,,365.597091259182
Carrer de Josepa Massanés,"4753775",https://es.wikipedia.org/wiki/Mar%C3%ADa_Josefa_Massan%C3%A9s,Female,,199.973359321256
Carrer de Sant Joaquim,"4753811",,Male,,215.614314210815
Carrer de Jesús,"4753812",,Male,,54.0094540687553
Carrer de Matilde,"4753816",,Female,,55.6623012166736
Carrer d'Andrea Dòria,"4754986",,Male,,106.095346739913
Carrer de Sant Miquel,"4755002",,Male,,130.33008623924
Carrer Marquès de la Mina,"4755020",,Male,,99.5657618784903
Carrer de Sant Elm,"4755027",,Male,,134.65423371315
Carrer de Sant Agustí,"4776269",,Male,,110.086101433566
Carrer de Sant Pere Màrtir,"4776272",,Male,,111.686732791805
Carrer de Benet Mercadé,"4776278",,Male,,100.606030092627
Carrer de Verdi,"4776301",,Male,,293.515482739597
Carrer de Rogent,"4776348",,Male,,657.591517737505
Carrer de Gabriel y Galán,"4776419",,Male,,230.512895632385
Carrer de la Riera de Sant Miquel,"4776522",,Male,,162.759732190567
Carrer de Minerva,"4776526",,Female,,55.8648440511837
Carrer de Copèrnic,"4776811",,Male,,899.416767747863
Carrer del Rector Ubach,"4776831",,Male,,467.362996077006
Carrer de Manuel Angelon,"4776836",,Male,,129.258953325835
Carrer de Julián Romea,"4776837",,Male,,109.863150946389
carrer de Santa Carolina,"4776838",,Female,,384.63864337289
Carrer de Rita Bonnat,"4776845",,Female,,172.264694074632
Carrer de Melcior de Palau,"4776857",,Male,,223.35656004503
Carrer de Martí,"4782183",,Male,,633.872374947208
Carrer de Sant Màrius,"4782201",,Male,,412.145278513217
Carrer de Rubens,"4782230",,Male,,327.346498664243
Carrer de Chapí,"4782261",,Male,,168.825640674466
Carrer de Manuel Sancho,"4782287",,Male,,103.221925062159
Carrer de Mossén Quinti Mallofré,"4782298",,Male,,180.274058110186
Carrer d'en Carabassa,"4785181",,Male,,62.2738883248032
Carrer del Doctor Joaquim Pou,"4785217",,Male,,128.360058406839
Carrer del Misser Ferrer,"4785221",,Male,,46.7716782578181
Carrer de Perot lo Lladre,"4785272",,Male,,83.669022702981
Carrer d'en Rosic,"4785321",,Male,,80.4828597155138
Carrer d'en Boquer,"4785325",,Male,,65.8377753695644
Carrer d'en Tarròs,"4785349",,Male,,117.602886884018
Carrer de la Neu de Sant Cugat,"4785350",,Male,,66.4283072311532
Carrer de Sant Pere Més Alt,"4785356",,Male,,409.888997425982
Carrer d'Amadeu Vives,"4785397",,Male,,99.5462697071234
Carrer de Lluís el Piadós,"4785398",,Male,,47.4242329959506
Carrer de les Arenes de Sant Pere,"4785413",,Male,,47.0846781787629
Carrer de Jaume Giralt,"4785419",,Male,,205.111138674832
Carrer d'en Roig,"4785420",,Male,,138.994001275685
Carrer de Santa Elena,"4785520",https://es.wikipedia.org/wiki/Helena_de_Constantinopla,Female,,105.241902215854
Carrer de Santa Madrona,"4785522",https://es.wikipedia.org/wiki/Madrona,Female,,187.335605956494
Carrer de Juan Bravo,"4787825",,Male,,167.082545375574
Carrer de Fernández Duró,"4787829",,Male,,123.220327121122
Carrer de Sant Pere d'Abanto,"4787835",,Male,,162.694559044768
Carrer de Sant Roc,"4787846",,Male,,256.332182028017
Carrer d'Alexandre de Torrelles,"4788225",,Male,,249.370054916551
Carrer de la Torre Dulac,"4788236",,Male,,132.001243985091
Carrer del Baró de Sant Lluís,"4788241",,Male,,56.0167215820824
Avinguda de la Mare de Déu de Montserrat,"4788261",https://es.wikipedia.org/wiki/Virgen_de_Montserrat,Female,,59.6674517284946
Carrer de Bismark,"4788265",,Male,,207.645474064871
Carrer d'Ercilla,"4788271",,Female,,358.367392075282
Carrer de Santa Anna,"4809709",https://es.wikipedia.org/wiki/Ana_(madre_de_Mar%C3%ADa),Female,,207.780831491478
Carrer d'Erasme de Janer,"4809711",,Male,,100.204309728216
Carrer de Sant Llàtzer,"4809712",,Male,,60.7744262519595
Carrer d'en Robador,"4809722",,Male,,84.9029085831367
Carrer del Comte de Santa Clara,"4809727",https://es.wikipedia.org/wiki/Clara_de_As%C3%ADs,Female,,21.8801971619423
Carrer de Grau i Torras,"4809729",,Male,,292.568480849787
Carrer de Berenguer Mallol,"4809739",,Male,,95.2681787933326
Carrer de Guillem,"4809751",,Male,,49.27486842978
Carrer del Príncep Jordi,"4813517",,Male,,12.3561552814668
Carrer de l'Elisi,"4813521",,Female,,152.164199921462
Carrer del Rector Triadó,"4813522",,Male,,213.148107319381
Avinguda del Santuari de Sant Josep de la Muntanya,"4818822",,Male,,180.975875874967
Carrer d'Homer,"4818840",,Male,,193.891390039611
Carrer de Maurici Serrahima,"4818847",,Male,,186.914649940442
Carrer d'Adolf Florensa,"5111090",,Male,,421.602587221017
Carrer del Pare Rodés,"6078463",,Male,,277.363722377613
Carrer de Felipe de Paz,"8087198",,Male,,313.079148866183
Passatge Felipe de Paz,"8087203",,Male,,50.5795174258953
Carrer de Conxita Supervia,"8087711",https://es.wikipedia.org/wiki/Conchita_Superv%C3%ADa,Female,,125.66185444014
Passeig de Josep Carner,"8380803",,Male,,23.2524957220395
Ronda de Sant Pere,"8380852",,Male,,274.791993388628
Carrer Santa Clotilde,"8590768",https://es.wikipedia.org/wiki/Clotilde_(reina),Female,,97.7652755761136
Carrer d'Enric Granados,"9405722",,Male,,137.08129106439
Passeig de Picasso,"9412955",,Male,,211.021227360656
Carrer de la Mercè,"9412964",,Female,,185.486681591909
Carrer de Ramón y Cajal,"9930038",,Male,,277.869336164941
Carrer de Santa Rosa,"9930126",https://es.wikipedia.org/wiki/Rosa_de_Lima_(santa),Female,,155.1356763705
Travessia de Sant Antoni,"9980759",,Male,,70.5077333341743
Travessia de Sant Antoni,"9980761",,Male,,75.7219746656322
Carrer de Badia,"9981229",,Female,,168.892019296736
Carrer de Mateu,"9982803",,Male,,101.272354296745
Carrer de Martí,"9983715",,Male,,95.3391197809943
Carrer de Santa Àgata,"9986520",https://es.wikipedia.org/wiki/%C3%81gueda_de_Catania,Female,,211.640815785941
Carrer de Santa Magdalena,"9986523",https://es.wikipedia.org/wiki/Santa_Magdalena_(desambiguaci%C3%B3n),Female,,88.2780212370953
Carrer de Santa Perpètua,"9987976",,Female,,141.731776371472
Carrer de Pere Serafí,"10070630",,Male,,79.6249261889758
Carrer de Sant Domènec,"10070800",,Male,,140.372587811012
Carrer Sant Pau,"10426329",,Male,,20.4711581314964
Carrer de Maria Aurèlia Capmany,"10428122",https://es.wikipedia.org/wiki/Maria_Aur%C3%A8lia_Capmany,Female,,103.509444060807
Carrer de Sant Pacià,"10428232",,Male,,113.118821654137
Carrer de Sant Bertran,"10511051",,Male,,114.403137929224
Carrer de Sant Oleguer,"10851867",,Male,,157.246731181576
Carrer de Sant Bartomeu,"10852812",,Male,,75.9589822907195
Carrer de Sant Martí,"10852897",,Male,,77.8895308413591
Carrer de Sant Pau,"10853180",,Male,,119.623043892627
Carrer de Guifré,"11300057",,Male,,85.3198656575073
Carrer d'en Xuclà,"11301079",,Male,,99.6449322970437
Passatge de Sant Bernat,"12373447",,Male,,104.354282923135
Carrer de Pi i Margall,"13712261",,Male,,89.4711501632088
Carrer de Joaquim Ruyra,"13717101",,Male,,139.221644689839
Carrer de Hipolit Lazaro,"13717264",,Male,,218.242703199878
Carrer de Pau Alsina,"13717339",,Male,,309.319339387341
Carrer de Sant Lluís,"13717449",,Male,,4.40980303133307
Carrer de Pau Alsina,"13718672",,Male,,443.226099818685
Carrer de Milà i Fontanals,"13719318",,Male,,67.450445048409
Plaça de la Font Castellana,"13722145",,Male,,106.213247031837
Carrer de Joan Blanques,"14194648",,Male,,62.2546482675127
Passeig de Santa Madrona,"16365469",https://es.wikipedia.org/wiki/Madrona,Female,,795.796104084738
Carrer de Joaquim Blume,"17201934",,Male,,139.909082616781
Carrer de Maria Montessori,"17202294",https://es.wikipedia.org/wiki/Maria_Montessori,Female,,129.646420544803
Carrer del Rei Martí,"17203687",,Male,,29.8734273797752
Carrer de Joanot Martorell,"17203920",,Male,,171.159046950728
Carrer del Sant Crist,"17204097",,Male,,262.186612163598
Carrer de Galileu,"18431550",,Male,,56.2963698291339
Carrer de l'Hort de Sant Pau,"18502193",,Male,,66.5474302152825
Passeig de Josep Carner,"18506598",,Male,,202.752946975266
Passeig de Josep Carner,"18507616",,Male,,302.351817785344
Passeig d'Isabel II,"18512190",https://es.wikipedia.org/wiki/Isabel_II_de_Espa%C3%B1a,Female,,160.79340696253
Plaça de Pau Vila,"18513172",,Male,,11.4005870918922
Carrer del Doctor Aiguader,"18513185",,Male,,138.900754712845
Passeig d'Isabel II,"18513247",https://es.wikipedia.org/wiki/Isabel_II_de_Espa%C3%B1a,Female,,163.042106593599
Carrer del Cid,"18595111",,Male,,60.0944404347114
Carrer de Montserrat,"18595138",,Female,,21.5933454376858
Carrer del Portal de Santa Madrona,"18596059",https://es.wikipedia.org/wiki/Madrona,Female,,73.5044228807156
Carrer de Santa Mònica,"18600454",https://es.wikipedia.org/wiki/M%C3%B3nica_de_Hipona,Female,,96.7948141835414
Carrer de l'Arc de Sant Pau,"18617908",,Male,,13.8282343868297
Carrer de Sant Ramon,"18618300",,Male,,146.751175041756
Passatge de Bernardí Martorell,"18618495",,Male,,20.298124502414
Carrer de l'Arc de Sant Agustí,"18658591",,Male,,127.333120519551
Carrer del Cardenal Casañas,"18831512",,Male,,96.4228288209358
Plaça Joaquim Xirau i Palau,"18833113",,Male,,90.8048110023341
Carrer de Josep Anselm Clavé,"18833123",,Male,,45.0928755454943
Carrer de la Princesa,"18968925",,Female,,116.823931646625
Passatge de Lluís Cutchet,"19832641",,Male,,1.99449043373195
Carrer Louis Braille,"19910145",,Male,,84.4255757604746
Passatge del Dormitori de Sant Francesc,"19913247",,Male,,70.2421277987385
Carrer de Marquet,"19914811",,Male,,100.886690497367
Carrer de Cervantes,"19915981",,Male,,65.5018465716517
Carrer de Palau,"19916059",,Male,,73.5013749951482
Baixada de Sant Miquel,"19916419",,Male,,79.6386249478208
Carrer d'Hèrcules,"19917066",,Male,,88.3783996574309
Carrer de la Reina Elionor,"19917682",https://es.wikipedia.org/wiki/Leonor_de_Arag%C3%B3n_y_Foix,Female,,31.8620822746427
Carrer d'en Gignàs,"19918639",,Male,,181.119476207112
Carrer de Salvador Aulet,"19919154",,Male,,42.8549285083497
Passatge d'Amadeu Bagués,"19921505",,Male,,7.10662785541545
Baixada de Santa Eulàlia,"19922468",https://es.wikipedia.org/wiki/Eulalia_de_Barcelona,Female,,43.8870920480492
Carrer de Sant Honorat,"19922473",,Male,,110.88654296125
Carrer de Sant Sever,"19922498",,Male,,63.9268855068344
Carrer del Doctor Joaquim Pou,"20020547",,Male,,35.5291277431569
Carrer de Tomàs Mieres,"20020745",,Male,,61.2379539799978
Carrer de Sant Pere Mitjà,"20045064",,Male,,358.58377164907
Carrer de Julià Portet,"20045898",,Male,,76.4960356886943
Carrer del General Álvarez de Castro,"20347403",,Male,,88.5683677607588
Carrer de Sant Pere Més Baix,"20347585",,Male,,164.997850210404
Carrer d'en Giralt el Pellisser,"20351563",,Male,,163.745064230482
Carrer de l'Arc de Sant Silvestre,"20352088",,Male,,48.2175203348303
Carrer del Pare Gallifa,"20352712",,Male,,53.6852137461841
Carrer de Duran i Bas,"20354177",,Male,,94.3928106236008
Carrer d'Alí Bei,"20475089",,Male,,233.614275091595
Passeig de Sant Joan,"20476283",,Male,,153.402832513856
Passeig de Lluís Companys,"20478115",,Male,,14.8462063414941
Passatge de Sant Benet,"21401529",,Male,,49.5138311906205
Passatge de Sant Benet,"21402074",,Male,,58.9132848362441
Plaça d'Antoni Maura,"21785463",,Male,,35.5561047322026
Carrer dels Cecs de Sant Cugat,"22412881",,Male,,66.6700167322063
Carrer d'Àngel J. Baixeras,"22416746",,Male,,16.8082602667815
Carrer de Santa Maria,"22421181",https://es.wikipedia.org/wiki/Mar%C3%ADa_(madre_de_Jes%C3%BAs),Female,,72.2889882902876
Carrer de Sant Antoni dels Sombrerers,"22423631",,Male,,54.2758770516048
Carrer de la Volta d'en Dusai,"22431111",,Male,,39.3764913658277
Carrer d'en Tantarantana,"22432582",,Male,,158.627626669888
Carrer de les Basses de Sant Pere,"22438773",,Male,,112.200211722238
Carrer d'en Cortines,"22440378",,Male,,154.577050614749
Carrer d'en Llàstics,"22448142",,Male,,86.510544452464
Carrer de la Reina Cristina,"22588133",https://es.wikipedia.org/wiki/Cristina_de_Suecia,Female,,101.57871910671
Passeig de Picasso,"22658522",,Male,,110.465010780337
Carrer de Ramon Trias Fargas,"22689284",,Male,,315.713472734717
Carrer de la Marquesa,"22689703",,Female,,128.513406767076
Carrer del General Castaños,"22689716",,Male,,130.057760879874
Carrer de l'Arc de Sant Cristòfol,"22724606",,Male,,65.226320569602
Carrer de Sant Domènec de Santa Caterina,"22724977",,Male,,24.1437952410878
Passeig de Lluís Companys,"23191706",,Male,,26.7235680721164
Passeig de Sant Joan,"23191707",,Male,,106.559060171664
Passeig de Sant Joan,"23191708",,Male,,111.04145932353
Avinguda del Doctor Marañón,"23247531",,Male,,439.948008173364
Avinguda de Mistral,"23348827",,Male,,3.73066308389203
Avinguda de Mistral,"23348856",,Male,,461.706868465098
Ronda del General Mitre,"23432710",,Male,,85.8848204944239
Carrer de González Tablas,"23492230",,Male,,102.8422067269
Carrer de Jordi Girona,"23492283",,Male,,100.820841165615
Carrer d'Isaac Albèniz,"23705274",,Male,,106.022006112451
Carrer de Sanpere i Miquel,"23734514",,Male,,163.730772639823
Carrer de Rivero,"23734520",,Male,,159.113669610199
Carrer de Pere Pau,"23787998",,Male,,144.528834666453
Carrer de Fulton,"23855892",,Male,,82.4437606852264
Carrer del Mestre Serradesanferm,"23857349",,Male,,102.340994235012
Carrer de Maria Paretas,"23857350",,Female,,55.4465137620016
Carrer de Quevedo,"24040894",,Male,,165.327695439537
Carrer de Pere IV,"24220819",,Male,,41.6563650832197
Carrer del Doctor Fleming,"24793121",,Male,,362.026875563803
Carrer de Bori i Fontestà,"24793131",,Male,,244.868109659454
Plaça de Sant Gregori Taumaturg,"24793408",,Male,,196.932495571969
Carrer de Johann Sebastian Bach,"24793515",,Male,,308.145725067444
Carrer de Ricardo Villa,"24793610",,Male,,193.66163211781
Carrer de Constança,"24793733",,Female,,79.9202287161904
Carrer de Constança,"24793737",,Female,,20.466929987222
Carrer de Beethoven,"24793818",,Male,,150.027159602009
Plaça de Can Baró,"25092920",,Male,,38.1478214473378
Carrer de Josep Yxart,"25092922",,Male,,91.8020491612463
Carrer de Pablo Sáez de Barés,"25092926",,Male,,11.368854853101
Carrer del Doctor Roux,"26293919",,Male,,308.881834813716
Carrer de Dolors Monserdà,"26293954",https://es.wikipedia.org/wiki/Dolors_Monserd%C3%A0,Female,,255.589537048196
Carrer de Demestre,"26293973",,Male,,115.923692491355
Carrer de la Marquesa de Vilallonga,"26294094",,Female,,558.039657356408
Carrer del Tenor Viñas,"26434305",,Male,,154.812203482616
Carrer de Santa Engràcia,"26468361",https://es.wikipedia.org/wiki/Engracia_de_Zaragoza,Female,,399.333093547487
Via Júlia,"26468369",,Female,,62.508873385381
Via Júlia,"26468379",,Female,,386.997344647314
Carrer de Sant Francesc Xavier,"26741447",,Male,,392.009229043815
Carrer d'Arístides Maillol,"27646031",,Male,,132.357649226802
Carrer de Sant Ildefons,"29042063",,Male,,56.8173603112201
Passeig de Santa Coloma,"29380295",https://es.wikipedia.org/wiki/Columba_de_Sens,Female,,210.875099695741
Passeig de Santa Coloma,"29380297",https://es.wikipedia.org/wiki/Columba_de_Sens,Female,,46.1807685295939
Passeig de Santa Coloma,"29380304",https://es.wikipedia.org/wiki/Columba_de_Sens,Female,,15.1630171833761
Carrer del Doctor Roux,"30014649",,Male,,60.0061385238877
Carrer de Dolors Monserdà,"30014787",https://es.wikipedia.org/wiki/Dolors_Monserd%C3%A0,Female,,36.3150082731201
