name,id,wikipedia_link,gender,scale,length
Passeig de Joan de Borbó,"237993542",,Male,,26.8976845694272
Carrer de Dolors Masferrer i Bosch,"238052315",https://ca.wikipedia.org/wiki/Dolors_Masferrer_i_Bosch,Female,,108.942797552924
Carrer de Joan d'Alòs,"238074992",,Male,,234.512254305482
Carrer de Mireia,"238179165",,Female,,166.812561654037
Plaça de Mossèn Clapés,"238179166",,Male,,82.8228256343477
Carrer del Bruc,"238179175",,Male,,281.921306306223
Carrer de Balmes,"238324874",,Male,,130.555649394098
Ronda de Sant Antoni,"238326403",,Male,,55.4984629120781
Carrer de Ramón y Cajal,"238466715",,Male,,139.101478260331
Carrer de la Mare de Déu de la Salut,"238466720",,Female,,136.673089436442
Carrer de Verdi,"238466736",,Male,,255.683242106779
Carrer de Sant Salvador,"238466738",,Male,,406.718807690746
Carrer de Verdi,"238466741",,Male,,190.557513032177
Carrer d'Arnold Schönberg,"238466744",,Male,,47.571861296479
Carrer de Martí i Julià,"238762326",,Male,,101.697164892069
Carrer de Manuel de Falla,"238762328",,Male,,43.8334451162278
Carrer de Manuel de Falla,"238762330",,Male,,84.6072910464427
Carrer del Taquígraf Martí,"238768625",,Male,,119.893872113996
Carrer del Taquígraf Martí,"238768626",,Male,,105.97425724346
Carrer de Galileu,"238768627",,Male,,94.9854190124407
Carrer de Joan Gamper,"238768635",,Male,,83.3726471620693
Passeig de la Reina Elisenda de Montcada,"238862118",https://es.wikipedia.org/wiki/Elisenda_de_Moncada,Female,,124.02683482493
Carrer de Can Caralleu,"238862122",,Male,,137.568862706423
Carrer de Balmes,"238866888",,Male,,400.402530508755
Carrer de Jaume Roig,"239195663",,Male,,164.025099480432
Carrer d'Arquímedes,"239224529",,Male,,87.0510610683923
Carrer Gran de Sant Andreu,"239224533",,Male,,404.801901260766
Carrer de Sant Iscle,"239299104",,Male,,206.663723470674
Carrer de Rere Sant Just,"239392883",,Male,,15.7950438761796
Carrer de Llull,"239562113",,Male,,253.49632645992
Carrer de l'Abat Safont,"239838074",,Male,,151.483754026936
Carrer d'Eusebi Planas,"240144545",,Male,,85.9798377829773
Carrer de Ramiro de Maeztu,"240312798",,Male,,214.631537655745
Plaça de Sant Pere,"240543249",,Male,,46.6653171768826
Plaça de Sant Pere,"240543250",,Male,,77.9952289222848
Carrer de Lleó XIII,"240724776",,Male,,518.547197858947
Ronda de Sant Antoni,"240873129",,Male,,160.740871194284
Ronda de Sant Antoni,"240873131",,Male,,60.3518096423716
Carrer de Vicent López,"241118346",,Male,,125.876508955678
Carrer d'En Botella,"241867923",,Male,,82.6105305749565
Carrer d'Anníbal,"241873465",,Male,,58.6359616808026
Carrer de Salvà,"241873466",,Male,,470.250562467188
Carrer de Sancho Marraco,"241874157",,Male,,39.5006867618813
Carrer de Sancho Marraco,"241874159",,Male,,11.3724081344508
Carrer de Sancho Marraco,"241874160",,Male,,34.3499651983982
Carrer de Sant Isidre,"241970600",,Male,,54.4429558887564
Carrer de Sant Isidre,"241972041",,Male,,40.4467862871143
Carrer d'Antoni de Capmany,"242211214",,Male,,18.2889201963517
Camí de Cal Notari,"243090157",,Male,,121.223807586026
Carrer del Comte de Santa Clara,"243093274",https://es.wikipedia.org/wiki/Clara_de_As%C3%ADs,Female,,68.0139853715119
Carrer de Galileu,"243598396",,Male,,108.990471975858
Passeig de Sant Antoni,"243598402",,Male,,91.7500948489411
Passeig de Sant Antoni,"243598403",,Male,,81.3477865278088
Plaça de Joan Peiró,"243598404",,Male,,57.2309966912954
Carrer de Can Segalar,"243693224",,Male,,89.6271254729389
Placeta de Ramon Torres i Casanovas,"243698002",,Male,,28.8356124812796
Carrer del Comte d'Urgell,"243716771",,Male,,112.041120858177
Carrer de Santa Dorotea,"243809302",https://es.wikipedia.org/wiki/Dorotea_(santa),Female,,115.18329369152
Carrer de Sant Fructuós,"244033513",,Male,,241.549245354917
Carrer de Sant Fructuós,"244033514",,Male,,223.793441027228
Carrer de Sant Fructuós,"244033515",,Male,,118.2793446229
Carrer de Sant Fructuós,"244033516",,Male,,118.245798926521
Via Júlia,"244451255",,Female,,372.904197434552
Carrer de Josep Sunyol i Garriga,"245023771",,Male,,50.1480253480912
Carrer d'Àngel J. Baixeras,"245214529",,Male,,67.6596499227717
Carrer d'Àngel J. Baixeras,"245214530",,Male,,4.43084494400741
Carrer d'Anníbal,"245321067",,Male,,56.9966654621267
Carrer de Sant Ildefons,"246128079",,Male,,251.530916705393
Plaça de l'Àngel,"246159415",,Male,,36.5829921478956
Carrer del Sots-tinent Navarro,"246159416",,Male,,202.613041189985
Plaça de l'Àngel,"246159417",,Male,,25.1209903376985
Carrer de Maria Aurèlia Capmany,"246630083",https://es.wikipedia.org/wiki/Maria_Aur%C3%A8lia_Capmany,Female,,19.6989650500318
Ronda de Sant Pau,"246638755",,Male,,135.404788235493
Carrer de Torres i Amat,"246638756",,Male,,92.5512294335851
Plaça de Pau Vila,"246640823",,Male,,43.7395469434597
Plaça de Pau Vila,"246640825",,Male,,124.103881416058
Plaça d'Antoni Maura,"246642907",,Male,,24.5959271400049
Plaça d'Ildefons Cerdà,"247038425",,Male,,39.2960826007037
carrer Nou de Santa Eulàlia,"247072752",https://es.wikipedia.org/wiki/Eulalia_de_Barcelona,Female,,72.4390468738483
carrer de Santa Filomena,"247072754",https://es.wikipedia.org/wiki/Filomena_(santa),Female,,88.0232177252972
carrer dels Tres Reis,"247072755",,Male,,20.6679192801057
Carrer de Ramon Miquel i Planas,"247075786",,Male,,242.092170379633
Camí vell de Santa Creu d'Olorda a Vallvidrera,"248555477",,Female,,102.21459458472
Camí vell de Santa Creu d'Olorda a Vallvidrera,"248555481",,Female,,21.4426003068251
Plaça de Mossèn Jacint Verdaguer,"248565671",,Male,,16.640705223849
Ronda de Sant Pere,"248565672",,Male,,124.247439464301
Carrer del Doctor Font i Quer,"248995806",,Male,,437.684090198874
Carrer de la Palma de Sant Just,"249271343",,Male,,74.3460415388887
Avinguda de Sant Ramon Nonat,"249808249",,Male,,12.03832114653
Carrer Cardenal Reig,"249808252",,Male,,106.976795230121
Carrer Cardenal Reig,"249808255",,Male,,191.187490634486
Plaça de la Bella Dorita,"249938214",https://es.wikipedia.org/wiki/La_Bella_Dorita,Female,,12.9342680992805
Carrer de la Riera de Sant Miquel,"249953942",,Male,,70.1770461823278
Carrer de la Riera de Sant Miquel,"249953943",,Male,,184.748995522088
Carrer de Jaume Fabra,"250368908",,Male,,86.6008540145764
Carrer de Jaume Fabra,"250368909",,Male,,28.3175789739219
Passeig d'Isabel II,"251073272",https://es.wikipedia.org/wiki/Isabel_II_de_Espa%C3%B1a,Female,,164.326729995644
Plaça del Cardenal Cicognani,"251197654",,Male,,121.868705982045
Carrer de Mateu Ferran,"251208795",,Male,,46.5208251762244
Carrer de Francisco Giner,"251458388",,Male,,149.310658080068
Carrer de Mariana Pineda,"251458389",https://es.wikipedia.org/wiki/Mariana_Pineda,Female,,53.5884654571328
Carrer de Sancho d'Avila,"251551137",,Male,,115.266168543635
Carrer de Pi i Margall,"251684606",,Male,,175.775498450014
Carrer de Sant Antoni Maria Claret,"251684607",,Male,,151.592065935075
Carrer de Ramiro de Maeztu,"251689434",,Male,,256.313438640834
Carrer de Pablo Sáez de Barés,"251689435",,Male,,75.504495752715
Avinguda de la Mare de Déu de Montserrat,"251746321",https://es.wikipedia.org/wiki/Virgen_de_Montserrat,Female,,185.909855587836
Avinguda de la Mare de Déu de Montserrat,"251746322",https://es.wikipedia.org/wiki/Virgen_de_Montserrat,Female,,80.4567257756725
Carrer d'Anna M. Martínez Sagi,"251746324",https://es.wikipedia.org/wiki/Ana_Mar%C3%ADa_Mart%C3%ADnez_Sagi,Female,,22.4464823435824
Carrer d'Anna Maria Martínez Sagi,"251746326",https://es.wikipedia.org/wiki/Ana_Mar%C3%ADa_Mart%C3%ADnez_Sagi,Female,,122.441733877964
Avinguda de Josep Tarradellas,"251749485",,Male,,68.4991163793916
Carrer Cardenal Reig,"251749487",,Male,,99.0265107474547
Carrer d'Arístides Maillol,"251749488",,Male,,224.033581895116
Carrer de Sant Adrià,"251749489",,Male,,48.4366119334924
Carrer del Concili de Trento,"251750783",,Male,,206.956538417124
Carrer de Roc Boronat,"253456735",,Male,,404.874040753622
Carrer de Roc Boronat,"253456736",,Male,,121.587895149264
Carrer de Llull,"253456740",,Male,,110.043479736558
Carrer de Llull,"253456741",,Male,,132.772676694238
Carrer de Salvador Mundí,"254329356",,Male,,33.037010758296
Carrer de Salvador Mundí,"254329357",,Male,,67.7431601260562
Carrer de Pau Romeva,"254329359",,Male,,128.047403389569
Carrer de Feliu i Codina,"254880420",,Male,,138.019623288296
Carrer de Marie Curie,"254880425",https://es.wikipedia.org/wiki/Marie_Curie,Female,,134.527659625695
Carrer de Marie Curie,"254880426",https://es.wikipedia.org/wiki/Marie_Curie,Female,,70.7023028537009
Carrer del Doctor Trueta,"255327558",,Male,,132.321733335596
Carrer del Doctor Trueta,"255327561",,Male,,119.365381337816
Carrer de Roc Boronat,"255327563",,Male,,29.2915283430675
Carrer d'Antoni de Capmany,"255470585",,Male,,29.0690164748815
Carrer d'Antoni de Capmany,"255472307",,Male,,70.268563263845
Carrer de Sant Adrià,"256021236",,Male,,306.139996136952
carrer de l'arquitecte Mas,"256410157",,Male,,27.531212458945
Carrer de Sant Dalmir,"256580776",,Male,,87.5907275175437
Carrer de la Mare de Déu dels Angels,"256580777",https://es.wikipedia.org/wiki/Nuestra_Se%C3%B1ora_de_los_%C3%81ngeles_(Getafe),Female,,64.3619515328195
Carrer de la Mare de Déu dels Angels,"256692189",https://es.wikipedia.org/wiki/Nuestra_Se%C3%B1ora_de_los_%C3%81ngeles_(Getafe),Female,,56.8945075539835
Passeig de la Mare de Déu del Coll,"256692308",,Female,,154.132388434685
Carrer de Sant Dalmir,"256692540",,Male,,31.8938788224558
Carrer de la Duquessa d'Orleans,"256733193",,Male,,140.644197340544
Carrer de la Duquessa d'Orleans,"256814757",,Male,,38.1558316158829
plaça de Castelló,"256972108",,Male,,25.7744776569799
Carrer de Ramiro de Maeztu,"257329039",,Male,,119.628104635319
Passatge Garcia i Robles,"257432221",,Male,,103.719747113475
Passeig de la Mare de Déu del Coll,"257562771",,Female,,169.174643839797
Passeig de la Mare de Déu del Coll,"257562772",,Female,,14.8320213814327
Plaça de Francesc Macià,"257568502",,Male,,83.6628828683181
Carrer de Feliu i Codina,"259618335",,Male,,24.5991553241845
Carrer de Diana,"259627175",,Female,,31.1366472292729
Riera de Marcel·lí,"259629169",,Male,,189.001173712416
Carrer de Pere Duran Farell,"260239171",,Male,,190.912772451641
Carrer de George R. Collins,"260239172",,Male,,51.7936216834729
Carrer del Doctor Bové,"260908596",,Male,,34.5351929868442
Carrer de Mossèn Josep Bundó,"260909711",,Male,,100.643750595734
Carrer de Santa Joana d'Arc,"260927894",https://es.wikipedia.org/wiki/Juana_de_Arco,Female,,46.4430901901767
Carrer de Sant Camil,"261673127",,Male,,94.8300636512107
Passatge de Peris i Mencheta,"262032887",,Male,,37.0968786912505
Plaça de l'Escultor Ramir Rocamora,"262513265",,Male,,103.900243204228
Carrer de Balmes,"262514248",,Male,,215.239827642021
Carrer de Vidal i Quadras,"262562622",,Male,,64.4552339237257
Carrer de Vidal i Quadras,"262562624",,Male,,168.626560292793
carrer dels Tres Reis,"262562627",,Male,,65.2863282509085
Carrer de Vidal i Quadras,"262562639",,Male,,75.3438912826801
Passatge Mare de Déu de l'Estrella,"262670178",,Female,,107.904590861379
Carrer de Tavern,"262723582",,Male,,226.928428747099
Carrer d'Eduardo Conde,"262748688",,Male,,36.7675414013832
Carrer d'Eduardo Conde,"262748689",,Male,,267.62640345834
Carrer de Baltasar Gracián,"262758536",,Male,,43.5546311844881
Carrer de Badosa,"262758538",,Male,,103.87371692468
Carrer de Baltasar Gracián,"262758539",,Male,,49.0566072804462
Carrer de Baltasar Gracián,"262835492",,Male,,51.5748830475151
Carrer de Pau Gargallo,"262841306",,Male,,175.2699328948
Carrer de Robert Robert,"263021641",,Male,,150.283548014651
Carrer de Sant Pere Claver,"263317775",,Male,,536.777763160145
Carrer de Sao Paulo,"263324421",,Male,,49.305075225215
Carrer de Ramón y Cajal,"263332959",,Male,,125.48355120724
Carrer de Sant Manuel,"263348222",,Male,,15.7816549076221
Carrer del Greco,"263348228",,Male,,15.9835457396735
Carrer de Mossèn Josep Bundó,"263348229",,Male,,72.7595188974026
Passatge de Santa Teresa,"263348232",https://es.wikipedia.org/wiki/Teresa_de_Jes%C3%BAs,Female,,69.6016122017913
Carrer de Segimon,"263351473",,Male,,130.331907284192
Carrer de Peris i Mencheta,"263351474",,Male,,303.934633835194
Carrer de Los Castillejos,"263405142",,Male,,1106.38647109946
Carrer de Los Castillejos,"263405146",,Male,,267.968930591634
Carrer de Los Castillejos,"263405153",,Male,,159.855664446726
Pas Fructuós Gelabert,"263489990",,Male,,84.3060082738182
Plaça de Joaquim Folguera,"264094181",,Male,,35.341615964902
carrer de Luz Casanova,"264164309",https://es.wikipedia.org/wiki/Luz_Casanova,Female,,118.297722789453
carrer de Marín,"264164311",,Male,,62.8535458244575
carrer de Joaquim Puig i Pidemunt,"264164320",,Male,,178.43221448177
carrer de Josep Sole i Barberà,"264164324",,Male,,110.922608128533
Carrer de la Riera de Sant Miquel,"264796448",,Male,,11.8112036503109
carrer del Doctor Rizal,"264796450",,Male,,34.1037180871681
carrer del Doctor Rizal,"264796454",,Male,,26.5343700242465
carrer del Doctor Rizal,"264796456",,Male,,49.5862228140003
Plaça de Narcís Oller,"264796457",,Male,,26.4927934007977
Plaça de Narcís Oller,"264796459",,Male,,22.8408680462522
Passatge de Chapí,"264970159",,Male,,66.507579742795
Carrer de Chapí,"264970160",,Male,,163.279315115308
Carrer de Sant Bernabe,"264970173",,Male,,83.3724428391544
Carrer de Santa Olívia,"264970183",https://es.wikipedia.org/wiki/Olivia,Female,,23.1888722132439
Carrer de Santa Olívia,"264970184",https://es.wikipedia.org/wiki/Olivia,Female,,14.901959528436
Passatge d'en Xinxó,"264981585",,Male,,26.7476621360812
Carrer d'Albert Llanas,"264981588",,Male,,24.6661260010123
Carrer de Rosario Pi,"265047831",https://es.wikipedia.org/wiki/Rosario_Pi,Female,,83.8526394331945
Plaça de Sant Francesc Xavier,"265049425",,Male,,57.3687027881387
Carrer de Santa Amàlia,"265053390",,Female,,33.0260431282238
Carrer de Santa Amàlia,"265053391",,Female,,85.6549605416935
Carrer de Lorena,"265071480",,Female,,46.1851829434565
Carrer de Lorena,"265071481",,Female,,63.5864950677283
Carrer de Sant Iscle,"265217765",,Male,,131.464357100847
Carrer de Sant Iscle,"265217767",,Male,,144.002337238895
Carrer de l'Arc de Sant Onofre,"265393221",,Male,,29.0335825997798
Carrer de l'Arc de Sant Onofre,"265393222",,Male,,5.24601456339664
Carrer Port de Rotterdam,"265430566",,Male,,329.657024547428
Carrer de Los Castillejos,"265867645",,Male,,30.8543078511443
Avinguda de Pearson,"267058516",,Male,,772.202630557441
Carrer de Sant Marc,"268565416",,Male,,119.087256987064
Carrer de Santa Eugènia,"268565418",https://es.wikipedia.org/wiki/Eugenia_(m%C3%A1rtir),Female,,96.1811111854984
Carrer de Luis Antúnez,"268565422",,Male,,240.099052829165
Carrer de Minerva,"268565423",,Female,,109.584429649687
Carrer de la Capella de Can Caralleu,"268983125",,Male,,131.064428040736
Carrer d'Eduardo Conde,"269149015",,Male,,144.693662905744
Carrer de Blai,"269788927",,Male,,444.313636244148
Carrer de Clara Zetkin,"269871719",https://es.wikipedia.org/wiki/Clara_Zetkin,Female,,50.9982716513599
Passatge de Joaquim Rita,"270797330",,Male,,114.844147932928
Carrer de Tomàs Padró,"271071003",,Male,,103.93206822793
Placeta de María Luz Morales,"271413925",https://es.wikipedia.org/wiki/Mar%C3%ADa_Luz_Morales,Female,,17.2884416324316
Carrer de Ramon Rocafull,"272646538",,Male,,197.141886363048
Carrer de Roc Boronat,"273302701",,Male,,85.8890768542879
Carrer de Pere IV,"273302702",,Male,,11.8605758284861
Carrer de Sant Joan de Malta,"274541098",,Male,,104.085715860557
Passeig de Santa Coloma,"274578253",https://es.wikipedia.org/wiki/Columba_de_Sens,Female,,12.8740965415053
Carrer de Manuel Ramon,"276198018",,Male,,79.6893893618529
Carrer del Pare Jacint Alegre,"276208164",,Male,,49.2327131011435
Carrer de Liuva,"276460548",,Male,,223.318133129649
Carrer de Liuva,"276460549",,Male,,33.4084076237514
Carrer de Sant Mateu,"276460550",,Male,,80.1765294232151
Carrer de Bonaventura Gispert,"276460551",,Male,,37.3261258903518
Carrer de Bonaventura Gispert,"276460552",,Male,,86.9489355005679
Carrer de Josep Soldevila,"276460553",,Male,,82.5369627339704
Carrer del Concili de Trento,"276963066",,Male,,135.111413617653
carrer del Pare Miquel de Sarrià,"277203504",,Male,,84.3095324575603
Carrer de Sant Antoni Maria Claret,"279897678",,Male,,114.261602169782
camí de Can Clos,"280408886",,Male,,213.639739157302
Carrer de Ferran Junoy,"281178164",,Male,,50.877094468055
Camí de Can Móra,"281259648",,Male,,263.746628319413
Passatge de Bernat Fenollar,"282883363",,Male,,36.0492223525659
Passatge de Bernat Fenollar,"282883364",,Male,,36.9675045166341
Carrer del Doctor Valls,"282883365",,Male,,40.3205049959818
Carrer de Teodor Llorente,"282883366",,Male,,120.517221153328
Carrer de Teodor Llorente,"283135602",,Male,,167.377479081013
Carrer del Doctor Aiguader,"283764984",,Male,,681.533314108479
Carrer d'en Xuclà,"284139873",,Male,,97.9969079939897
Carrer de Pere Llobet,"284404471",,Male,,132.20135860515
Passeig de Sant Joan,"284450136",,Male,,240.693883198681
Carrer de Concepció Arenal,"284577562",https://es.wikipedia.org/wiki/Concepci%C3%B3n_Arenal,Female,,552.682591286986
Carrer de Ramon Albó,"284577563",,Male,,125.473641521629
Carrer de Prat d'en Roquer,"284577564",,Male,,163.276634427952
Carrer de Prat d'en Roquer,"284577565",,Male,,72.4926574207624
Carrer de Sant Antoni Maria Claret,"284579038",,Male,,151.446948552073
Carrer de Sant Roc,"285182793",,Male,,13.7199289284845
Carrer de Sant Casimir,"285759144",,Male,,81.5108901112328
Ronda del General Mitre,"287522296",,Male,,141.318562592035
Ronda del General Mitre,"287522297",,Male,,90.1200085858931
Ronda del General Mitre,"287522308",,Male,,78.5234839414073
Carrer de Sant Magí,"287522310",,Male,,13.1475852769686
Ronda del General Mitre,"287522312",,Male,,39.2485742574875
Ronda del General Mitre,"287522313",,Male,,88.3155253963106
Ronda del General Mitre,"287522315",,Male,,39.3260108931073
Carrer de José Millán González,"287523816",,Male,,83.9950518561655
Carrer de Josep Serrano,"287523817",,Male,,176.288185988349
Carrer de Josep Serrano,"287523819",,Male,,137.954474542141
Carrer de Balmes,"287683998",,Male,,278.191231229983
Passeig de Joan de Borbó,"287856806",,Male,,33.1314584187157
Carrer del Doctor Aiguader,"287860388",,Male,,139.477227146353
Carrer del Doctor Roux,"287878242",,Male,,8.78856552768261
Carrer de Joan Torras,"287896384",,Male,,88.5305658216955
Carrer Gran de Sant Andreu,"287896385",,Male,,17.5174061215815
Carrer Gran de Sant Andreu,"287896386",,Male,,343.360179705638
Carrer d'en Paixalet,"287896399",,Male,,87.2203331911088
Passatge de Jacint Guardiola,"287896402",,Male,,88.4572176249142
Carrer del Beat Domènec Savio,"288447338",,Male,,80.9134742572008
Carreró de Sant Bonaventura,"288489906",,Male,,28.2421129023527
Carrer de Joan Blanques,"288595616",,Male,,32.620545026161
Carrer de Joan Blanques,"288595617",,Male,,156.621045231293
Carrer de Joan Blanques,"288595618",,Male,,71.1046652165095
Carrer de Joan Blanques,"288595619",,Male,,97.260721420255
Carrer del General Vives,"288612542",,Male,,167.521508997964
Carrer de Can Caralleu,"288612544",,Male,,101.168194810946
Carrer de Can Caralleu,"288612545",,Male,,141.222689960827
Carrer de Francisco Giner,"289979602",,Male,,98.1535727427979
Carrer de Domènech,"289979603",,Male,,45.1361275919233
Carrer d'Apel·les Fenosa,"289979604",,Male,,13.2493596983978
Carrer d'Apel·les Fenosa,"289979605",,Male,,85.3268245610105
Carrer d'en Tissó,"290137831",,Male,,535.446898497152
Carrer d'en Tissó,"290137832",,Male,,38.5418639151266
Carrer d'en Tissó,"290137833",,Male,,16.2569845024003
Passeig de Joan de Borbó,"291731094",,Male,,273.172597518552
Passeig de Joan de Borbó,"291731095",,Male,,53.4804255932544
Passeig de Joan de Borbó,"291731096",,Male,,92.3838756458241
Carrer de Rosa Sensat,"292300527",https://es.wikipedia.org/wiki/Rosa_Sensat_i_Vila,Female,,304.191564382547
Carrer de Rosa Sensat,"292300528",https://es.wikipedia.org/wiki/Rosa_Sensat_i_Vila,Female,,15.634512382073
Carrer de Rosa Sensat,"292300529",https://es.wikipedia.org/wiki/Rosa_Sensat_i_Vila,Female,,18.2807171419548
Placeta de Rafaela Serrano,"293673417",,Female,,38.3152767024038
Carrer de Balmes,"293858815",,Male,,6.06098944430353
Carrer del Doctor Aiguader,"293858825",,Male,,456.162087499445
Carrer del Doctor Aiguader,"293858826",,Male,,121.003982242985
Passeig de Joan Salvat Papasseit,"293858829",,Male,,91.5251086479493
Passeig de Joan Salvat Papasseit,"293858830",,Male,,161.204516436212
Carrer de Riego,"294021545",,Male,,113.584584668074
Carrer del Rector Triadó,"294021549",,Male,,64.4834571479765
Passeig de Sant Antoni,"294021550",,Male,,21.9108857326303
Carrer de l'Hort de la Vila,"294056752",,Female,,22.5273869575703
Ronda del General Mitre,"294056755",,Male,,87.6232649330701
Passeig de Santa Coloma,"295009013",https://es.wikipedia.org/wiki/Columba_de_Sens,Female,,95.0188185110914
Passeig de Santa Coloma,"295009014",https://es.wikipedia.org/wiki/Columba_de_Sens,Female,,39.4854521659005
Carrer del Portal de Santa Madrona,"295215807",https://es.wikipedia.org/wiki/Madrona,Female,,7.46585485322597
Carrer del Portal de Santa Madrona,"295215808",https://es.wikipedia.org/wiki/Madrona,Female,,242.708187064473
Carrer del Comte d'Urgell,"295263586",,Male,,23.81672913614
Ronda de Sant Pere,"295263592",,Male,,14.2222927862143
Passeig de Santa Eulàlia,"295268541",https://es.wikipedia.org/wiki/Eulalia_de_Barcelona,Female,,77.1685026350986
Carrer del General Vives,"295271630",,Male,,16.8583957446145
Carrer del General Vives,"295271631",,Male,,155.268933553311
Passeig de Santa Eulàlia,"295273084",https://es.wikipedia.org/wiki/Eulalia_de_Barcelona,Female,,35.4586372609344
Carrer de Balmes,"295281481",,Male,,263.575087091884
Carrer del Concili de Trento,"296682133",,Male,,67.2346017741318
Carrer de Joan Cortada,"296776160",,Male,,40.622957094371
Avinguda de Can Baró,"296811255",,Male,,161.159183404442
Plaça de la Font Castellana,"296815417",,Male,,73.7513243649109
Plaça de la Font Castellana,"296815419",,Male,,43.8668574615578
Plaça de la Font Castellana,"296815420",,Male,,10.0376704244718
Carrer de Josep Serrano,"296815421",,Male,,45.6410172799874
Carrer de Francesc Alegre,"296815424",,Male,,171.191869011724
Carrer del Baró de Sant Lluís,"296815426",,Male,,207.532111918551
Plaça de la Font Castellana,"296815428",,Male,,18.6409036510886
Avinguda de la Mare de Déu de Montserrat,"296815432",https://es.wikipedia.org/wiki/Virgen_de_Montserrat,Female,,117.799484081403
Avinguda de Pompeu Fabra,"296827107",,Male,,55.8611066982584
Carrer de Sant Lluis,"296827117",,Male,,52.2519278014898
Carrer de Pi i Margall,"296827119",,Male,,140.863495588409
Carrer de Miquel i Badia,"296944324",,Male,,131.186084352529
Passeig Marítim de Gabriel Roca,"297207986",,Male,,92.8146202909961
Passeig Marítim de Gabriel Roca,"297207992",,Male,,18.3208863047714
Passeig Marítim de Gabriel Roca,"297207999",,Male,,25.3548251079586
Carrer de Joan Cortada,"297482311",,Male,,120.890862230692
Carrer dels Lamote de Grignon,"299072145",,Male,,46.3355329083236
Passatge de Sant Benet,"299211103",,Male,,31.6192143280792
Carrer de Lluís el Piadós,"299211104",,Male,,56.0555127403419
Carrer d'Andrade,"300425793",,Male,,16.8249247134653
Passatge de Méndez Vigo,"300664624",,Male,,131.939666645146
Passatge de Roger de Flor,"300664627",,Male,,67.9372960660211
Carrer de Ramon Turró,"300699662",,Male,,86.9627468818835
Carrer del Concili de Trento,"300845952",,Male,,18.2029375935316
Carrer de Rossend Nobas,"300845957",,Male,,65.5659025993825
Carrer de Jesús,"301305579",,Male,,85.4924594767316
Carrer de Sant Pere Màrtir,"301305580",,Male,,2.95691854716277
Carrer de Sant Pere Màrtir,"301305581",,Male,,5.49781074697179
Plaça del Doctor Modrego,"301322221",,Male,,53.4714254844986
Plaça del Doctor Modrego,"301322222",,Male,,53.7242954313863
Carrer d'Alexandre Galí,"301322224",,Male,,319.727050099299
Carrer de Gordi,"301326210",,Male,,32.1810832790765
Carrer de Joan d'Àustria,"301443369",,Male,,21.9698708960877
Carrer de Joan d'Àustria,"301443370",,Male,,122.820548379429
Carrer de Joan d'Àustria,"301443371",,Male,,132.67709832237
Carrer de Joan d'Àustria,"301443373",,Male,,116.960280476224
Carrer de Joan d'Àustria,"301443374",,Male,,140.986797810041
Carrer del Doctor Roux,"301453288",,Male,,57.0774774897625
Carrer del Doctor Roux,"301453291",,Male,,102.099371810601
Plaça d'Adrià,"301459433",,Male,,75.5194790670867
Plaça d'Adrià,"301459434",,Male,,84.8217093476327
Carrer d'Illas i Vidal,"301459435",,Male,,43.2142451443702
Carrer de Ferran Valls i Taverner,"301459438",,Male,,237.761612786229
Carrer de Sant Gabriel,"301780477",,Male,,132.265743481184
Carrer de Sant Cristòfol,"301780478",,Male,,74.5338094981359
Carrer de Benet Mercadé,"301780479",,Male,,85.1421376381915
Carrer de Joan Ferrandiz,"301800683",,Male,,46.2341800661082
Plaça de Narcisa Freixas,"301800684",https://es.wikipedia.org/wiki/Narcisa_Freixas,Female,,46.2420114546374
Carrer de Joan Alcover,"301803997",,Male,,122.484972463406
Carrer de Sant Miquel,"303325045",,Male,,40.2647147783406
Carrer de l'Ave Maria,"303969224",,Female,,32.5061436244633
Carrer d'en Rauric,"303969226",,Male,,136.441602972162
Carrer de l'Arc de Santa Eulàlia,"303969228",https://es.wikipedia.org/wiki/Eulalia_de_Barcelona,Female,,47.4764299276388
Carrer de l'Arc de Santa Eulàlia,"304069728",https://es.wikipedia.org/wiki/Eulalia_de_Barcelona,Female,,7.98009038132919
Carrer de la Puríssima Concepció,"304069740",https://es.wikipedia.org/wiki/Inmaculada_Concepci%C3%B3n,Female,,119.893470466123
Carrer del Doctor Ibáñez,"306105067",,Male,,80.6882961658843
Carrer de Joaquim Molins,"306130978",,Male,,111.876129854394
Carrer del Doctor Nubiola i Espinós,"306130980",,Male,,71.3027540080297
Carrer del Doctor Nubiola i Espinós,"306130981",,Male,,61.7842968052655
Carrer de Francesc Pedra,"306130982",,Male,,66.391328806268
Carrer d'Hug de Rocabertí,"306130984",,Male,,44.8302111143239
